title,abstract,publication_date,url
Time-Varying Impact of Commodity Prices on Output Growth and Inflation in the Eastern European Countries,"Using quarterly data for the 2002–2022 period, we estimate the output and inflation effects of several commodity prices (agricultural raw materials, crude oil, and metals) for 8 Eastern European countries with different exchange rate regimes. The Kalman filter is used for estimating the time-varying parameters. Our main findings can be summarized in the following way: (i) higher crude oil prices are inflationary in most of the countries (except Slovakia), with a stronger price effect since 2020; (ii) crude oil prices are neutral with respect to output growth in 4 out of 8 countries, with an expansionary effect in Croatia, Slovenia, and Romania, as well as a contractionary effect in Slovakia, but the crude oil shock of 2021–2022 seems to be expansionary in almost all countries (except Slovakia), regardless of the exchange rate regime practiced; (iii) inflation and output effects of metals prices are quite heterogeneous across countries; (iv) agricultural raw material prices play a role in both inflation and output growth only in Bulgaria and Poland. Since 2021, a growing inflationary impact of crude oil prices suggests a stronger monetary policy reaction to the oil shock, especially in the presence of its favorable output effect.",2023-12-20,
The impact of financial speculation on futures contracts price movements: A study of the US markets for dairy commodities,"Research background: The study analyzes whether financial speculation destabilizes commodity prices in light of recent price volatility and spikes in agricultural commodities. The study delves deeper into the US dairy futures markets, which are less studied by other authors in their research and relatively new in comparison to other agricultural commodity markets. These dairy commodity futures contracts provide dairy businesses and farmers the chance to hedge against price risks, which are particularly crucial in uncertain economic times such as the post-2020 COVID-19 pandemic timeframe. The analysis makes use of the weekly returns on futures contracts for nonfat milk powder, butter, milk class III, and cheese that are obtained from the Chicago Mercantile Exchange (CME). Purpose of the article: Conduct an empirical study to evaluate the effect of financial speculation on dairy product prices on US commodity markets, including the post-2020 timeframe. Methods: Time series analysis is used in the investigation: the generalized auto-regressive conditional heteroskedasticity (GARCH) method, the Granger causality test, and the Augmented Dickey-Fuller (ADF) test. Findings &amp; value added: Our analysis's findings show that, even though most commodities experienced an increase in return volatility during the post-2020 period, there is no evidence for financial speculation being the cause of increased returns from dairy futures contracts. The research also suggests that financial speculation, in some cases, even lowers the volatility of dairy futures prices. Therefore, non-commercial market participants may help to distribute price risks, making these markets more liquid.",2023-09-30,
Quantifying Spillovers and Connectedness Among Commodities and Cryptocurrencies: Evidence from a Quantile-Var Analysis,"This study examines dynamic connectedness linkages between pairs and among different commodities, including precious metals, manufacturing metals, oil, natural gas, and Bitcoin, since the emergence of the cryptocurrency market. The Quantile-VAR methodology is utilised to identify causal spillovers over the period 2015 through 2022, where results demonstrate significantly stronger pairwise connectedness at extreme quantiles, where the gold-silver and copper-oil pairs exhibit the strongest linkages. Additionally, the overall dynamic connectedness is higher at the lowest and highest quantiles, which are reinforced during inflationary periods. Copper is identified as the strongest generator of spillovers, followed by silver, nickel, and zinc. Mixed findings are observed for gold and aluminium, whereas oil, natural gas, and Bitcoin are clearly observed to be net receivers. This study provides insight into the previously unknown aspects of diversifying or hedging abilities in the commodities and cryptocurrency markets during alternative economic and financial conditions.",2023-01-01,
Quantifying Spillovers and Connectedness Among Commodities and Cryptocurrencies: Evidence from a Quantile-Var Analysis,"This study examines dynamic connectedness linkages between pairs and among different commodities, including precious metals, manufacturing metals, oil, natural gas, and Bitcoin, since the emergence of the cryptocurrency market. The Quantile-VAR methodology is utilised to identify causal spillovers over the period 2015 through 2022, where results demonstrate significantly stronger pairwise connectedness at extreme quantiles, where the gold-silver and copper-oil pairs exhibit the strongest linkages. Additionally, the overall dynamic connectedness is higher at the lowest and highest quantiles, which are reinforced during inflationary periods. Copper is identified as the strongest generator of spillovers, followed by silver, nickel, and zinc. Mixed findings are observed for gold and aluminium, whereas oil, natural gas, and Bitcoin are clearly observed to be net receivers. This study provides insight into the previously unknown aspects of diversifying or hedging abilities in the commodities and cryptocurrency markets during alternative economic and financial conditions.",2023-01-01,
Understanding Dynamic Volatility Spillovers Amongst Major Commodity Futures and the US Stock Market,Download This Paper Open PDF in Browser Add Paper to My Library Share: Permalink Using these links will ensure access to this page indefinitely Copy URL Copy DOI,2023-01-01,
Biodiversity Risks in Commodity Markets,"As global biodiversity declines, market participants are increasingly attentive to the financial implications of biodiversity risks. We study the effects of biodiversity risks on commodities futures returns using a novel biodiversity risk index over 2005-2022. Biodiversity risks can’t predict commodities returns, suggesting risk underestimation. Using dynamic conditional correlations (DCCs), we further show that precious metals offer diversification against biodiversity risks, while energy commodities can serve as a hedge or safe haven. However, agricultural commodities don’t provide protection against biodiversity risks, potentially increasing investors exposure to these risks. Our findings are significant for investors and regulators interested in addressing biodiversity risks.",2023-01-01,
Commodity Correlation Risk,"It is widely observed that primary commodity prices comove. A parallel literature asserts that correlation risk matters for financial returns. Our novel study connects these topics and presents evidence that commodity correlation risk is both non-constant and important for returns. We reconsider therefore the relationship between primary commodities, risk and macro fundamentals, utilising methods that account for parameter uncertainty and stochastic volatility. We show that correlation risk is positively related to commodity returns and the strongest impact of risk upon return is more recent. We also demonstrate that commodity correlation risk is strongly counter-cyclical, correlation risk predicts returns, our risk measure is unrelated to other risk/uncertainty measures, and that correlation risk is linked to commodity financialization.",2022-01-01,
Systemic Risk of Commodity Traders,We examine the disruptions to global commodity flows following the bankruptcy of a commodity trading firm. The physical commodity network is operated by a handful of large traders that are responsible for the timely delivery of raw materials and inputs to industrial production. We propose a model that simulates the resilience and response time of the network following a shock. Our results suggest that a number of commodity traders carry significant systemic risk. The forced removal of a trader from the network has considerable implications for the prices and availability of physical commodities over a period of 6 to 12 months.,2022-01-01,
